{
  "schema_version": 1,
  "release_name": "lab-research-os-core",
  "version": "0.1.0-draft",
  "license_spdx": null,
  "license_source": null,
  "forbidden_terms": [
    "C:/Users/",
    "C:\\Users\\",
    "D:/20_代码项目/",
    "D:\\20_代码项目\\",
    "D:/10_学业科研/",
    "D:\\10_学业科研\\",
    "D:/项目仓库/",
    "BD4XDA",
    "ASUS"
  ],
  "files": [
    {"source": "release/public-seed/.gitignore", "target": ".gitignore"},
    {"source": "release/public-seed/.lab-project.json", "target": ".lab-project.json"},
    {"source": "release/public-seed/AGENTS.md", "target": "AGENTS.md"},
    {"source": "release/public-seed/PROJECT.md", "target": "PROJECT.md"},
    {"source": "release/public-seed/SOL-AGENT.md", "target": "SOL-AGENT.md"},
    {"source": "release/public-seed/README.md", "target": "README.md"},
    {"source": "release/public-seed/SECURITY.md", "target": "SECURITY.md"},
    {"source": "release/public-seed/CONTRIBUTING.md", "target": "CONTRIBUTING.md"},
    {"source": "release/public-seed/CODE_OF_CONDUCT.md", "target": "CODE_OF_CONDUCT.md"},
    {"source": "release/public-seed/requirements.txt", "target": "requirements.txt"},
    {"source": "release/public-seed/packets/bootstrap.json", "target": "packets/bootstrap.json"},
    {"source": "config/model-routing.json", "target": "config/model-routing.json"},
    {"source": "protocols/MODEL-ROUTING.md", "target": "protocols/MODEL-ROUTING.md"},
    {"source": "protocols/RESOURCE-GOVERNANCE.md", "target": "protocols/RESOURCE-GOVERNANCE.md"},
    {"source": "protocols/COST-TELEMETRY.md", "target": "protocols/COST-TELEMETRY.md"},
    {"source": "tools/foundation.py", "target": "tools/foundation.py"},
    {"source": "tools/contracts.py", "target": "tools/contracts.py"},
    {"source": "tools/model_routing.py", "target": "tools/model_routing.py"},
    {"source": "tools/cost_telemetry.py", "target": "tools/cost_telemetry.py"},
    {"source": "schemas/agent-harness.schema.json", "target": "schemas/agent-harness.schema.json"},
    {"source": "schemas/conflict.schema.json", "target": "schemas/conflict.schema.json"},
    {"source": "schemas/evidence.schema.json", "target": "schemas/evidence.schema.json"},
    {"source": "schemas/exception.schema.json", "target": "schemas/exception.schema.json"},
    {"source": "schemas/instruction-memory.schema.json", "target": "schemas/instruction-memory.schema.json"},
    {"source": "schemas/model-routing.schema.json", "target": "schemas/model-routing.schema.json"},
    {"source": "schemas/project.schema.json", "target": "schemas/project.schema.json"},
    {"source": "schemas/task-packet.schema.json", "target": "schemas/task-packet.schema.json"},
    {"source": "schemas/verification.schema.json", "target": "schemas/verification.schema.json"},
    {"source": "schemas/workspace.schema.json", "target": "schemas/workspace.schema.json"},
    {"source": "tests/test_contracts.py", "target": "tests/test_contracts.py"},
    {"source": "tests/test_foundation.py", "target": "tests/test_foundation.py"},
    {"source": "tests/test_model_routing.py", "target": "tests/test_model_routing.py"},
    {"source": "tests/test_cost_telemetry.py", "target": "tests/test_cost_telemetry.py"}
  ]
}
